{
  "schemaVersion": 1,
  "releaseId": "release-20260717-001",
  "environment": "production",
  "trafficProvider": "clb",
  "files": {
    "releaseManifest": ".artifacts/tke/releases/release-20260717-001/release-manifest.json",
    "cloudBundle": ".artifacts/tke/production/manifest.json",
    "evidenceBundle": ".artifacts/tke/releases/release-20260717-001/evidence.json",
    "checkpoint": ".artifacts/tke/releases/release-20260717-001/checkpoint.json"
  },
  "expectedHashes": {
    "releaseManifest": "aaaaaaaaaaaaaaaaaaaaaaaaaaaaaaaaaaaaaaaaaaaaaaaaaaaaaaaaaaaaaaaa",
    "cloudBundle": "bbbbbbbbbbbbbbbbbbbbbbbbbbbbbbbbbbbbbbbbbbbbbbbbbbbbbbbbbbbbbbbb",
    "evidenceBundle": "cccccccccccccccccccccccccccccccccccccccccccccccccccccccccccccccc",
    "checkpoint": "dddddddddddddddddddddddddddddddddddddddddddddddddddddddddddddddd"
  },
  "steps": [
    { "weight": 5, "minimumObservationSeconds": 900 },
    { "weight": 25, "minimumObservationSeconds": 900 },
    { "weight": 50, "minimumObservationSeconds": 900 },
    { "weight": 100, "minimumObservationSeconds": 900 }
  ],
  "rollbackTargetWeight": 0
}
